CODIGO,ESTABLECIMIENTO,DEPARTAMENTO,MUNICIPIO,TELEFONO
00-01-0168-46,INSTITUTO DE EDUCACION DIVERSIFICADA LICEO MARIANO GALVEZ,CIUDAD CAPITAL,ZONA 1,
00-01-0185-46,INSTITUTO PRIVADO PARA SENORITAS DE EDUCACION DIVERSIFICADA ACADEMIA PRACTICA COMERCIAL,CIUDAD CAPITAL,ZONA 1,
00-01-0188-46,COLEGIO VOCACIONAL GUATEMALTECO MENTES SANAS,CIUDAD CAPITAL,ZONA 1,
00-01-0189-46,INSTITUTO FEDERICO CROWE,CIUDAD CAPITAL,ZONA 1,
00-01-0260-46,INSTITUTO PRIVADO MIXTO DE EDUCACION DIVERSIFICADA COLEGIO PRE UNIVERSITARIO CATOLICO DE GUATEMALA,CIUDAD CAPITAL,ZONA 1,
00-01-0263-46,INSTITUTO PRIVADO MIXTO DE BACHILLERATO POR MADUREZ PRACTICA COMERCIAL,CIUDAD CAPITAL,ZONA 1,
00-01-0271-46,INSTITUTO PRIVADO MIXTO DE EDUCACION DIVERSIFICADA PRIMERA ESCUELA NOCTURNA JORGE VICTOR JUAREZ GARCIA,CIUDAD CAPITAL,ZONA 1,
00-01-0277-46,INSTITUTO PRIVADO MIXTO DE EDUCACION DIVERSIFICADA ACADEMIA PRACTICA COMERCIAL BACHILLERATO POR MADUREZ,CIUDAD CAPITAL,ZONA 1,
00-01-0295-46,INSTITUTO MIXTO PRIVADO JOHN F KENNEDY,CIUDAD CAPITAL,ZONA 1,
00-01-0297-46,COLEGIO MIXTO BILINGUE ANGLO HISPANO,CIUDAD CAPITAL,ZONA 1,
00-01-0298-46,INSTITUTO MIXTO DE COMPUTACION LEONARDO DE PISA,CIUDAD CAPITAL,ZONA 1,
00-01-0299-46,INSTITUTO MIXTO DE COMPUTACION LEONARDO DE PISA,CIUDAD CAPITAL,ZONA 1,
00-01-0300-46,INSTITUTO DE SENORITAS EL ROSARIO,CIUDAD CAPITAL,ZONA 1,
00-01-0301-46,INSTITUTO MIXTO VESPERTINO RAFAEL LANDIVAR,CIUDAD CAPITAL,ZONA 1,
00-01-0302-46,,CIUDAD CAPITAL,ZONA 1,
00-01-0303-46,INSTITUTO MIXTO VESPERTINO RAFAEL LANDIVAR,CIUDAD CAPITAL,ZONA 1,
00-01-0311-46,COLEGIO SAN JOSE DEL VALLE DE GUATEMALA,CIUDAD CAPITAL,ZONA 1,
00-01-0312-46,COLEGIO NACIONAL AMERICANO,CIUDAD CAPITAL,ZONA 1,
00-01-0313-46,INSTITUTO DE EDUCACION MEDIA A E U CENTRAL,CIUDAD CAPITAL,ZONA 1,
00-01-0314-46,INSTITUTO PRIVADO TECNICO AMERICANO,CIUDAD CAPITAL,ZONA 1,
00-01-0315-46,COLEGIO KEPLER,CIUDAD CAPITAL,ZONA 1,
00-01-0328-46,COLEGIO TECNICO EN COMPUTACION,CIUDAD CAPITAL,ZONA 1,
00-01-0329-46,COLEGIO MIXTO DIURNO NOCTURNO LA ENSENANZA,CIUDAD CAPITAL,ZONA 1,
00-01-0330-46,COLEGIO SUPERIOR GUATEMALTECO,CIUDAD CAPITAL,ZONA 1,
00-01-0331-46,ESCUELA SISTEMATIZADA EN COMPUTACION,CIUDAD CAPITAL,ZONA 1,
00-01-0333-46,INSTITUTO INDIGENA NUESTRA SENORA DEL SOCORRO,CIUDAD CAPITAL,ZONA 1,
00-01-0334-46,COLEGIO INGLES AMERICANO,CIUDAD CAPITAL,ZONA 1,
00-01-0337-46,COLEGIO PARA ADULTOS AHALCAB,CIUDAD CAPITAL,ZONA 1,
00-01-0338-46,COLEGIO JEFFERSON,CIUDAD CAPITAL,ZONA 1,
00-01-0352-46,COLEGIO RAMA ADULTA GUATEMALTECA DE DESEO ESTUDIANTIL R A G D E,CIUDAD CAPITAL,ZONA 1,
00-01-0358-46,LICEO TECNICO INTEGRAL SANTA TERESA DE JESUS,CIUDAD CAPITAL,ZONA 1,
00-01-0370-46,INSTITUTO MIXTO RAFAEL LANDIVAR Y CABALLERO,CIUDAD CAPITAL,ZONA 1,
00-01-0371-46,COLEGIO INTERNACIONAL AMERICANO,CIUDAD CAPITAL,ZONA 1,
00-01-0372-46,INSTITUTO PRIVADO MIXTO NOCTURNO RAFAEL LANDIVAR,CIUDAD CAPITAL,ZONA 1,
00-01-0378-46,COLEGIO MIXTO BROWNS,CIUDAD CAPITAL,ZONA 1,
00-01-0385-46,COLEGIO DE INNOVACION TECNOLOGICA EDUCATIVA C I T E,CIUDAD CAPITAL,ZONA 1,
00-01-0393-46,COLEGIO ABRAHAM LINCOLN,CIUDAD CAPITAL,ZONA 1,
00-01-0394-46,COLEGIO ABRAHAM LINCOLN,CIUDAD CAPITAL,ZONA 1,
00-01-0404-46,COLEGIO SECRETARIAL GUATEMALTECO,CIUDAD CAPITAL,ZONA 1,
00-01-0405-46,COLEGIO BROWNS,CIUDAD CAPITAL,ZONA 1,
00-01-0420-46,LICEO APLICADO EN COMPUTACION,CIUDAD CAPITAL,ZONA 1,
00-01-0421-46,INSTITUTO CULTURAL AMERICANO,CIUDAD CAPITAL,ZONA 1,
00-01-0422-46,COLEGIO SANTO DOMINGO,CIUDAD CAPITAL,ZONA 1,
00-01-0423-46,INSTITUTO CENTROAMERICANO DE MERCADOTECNIA Y PUBLICIDAD,CIUDAD CAPITAL,ZONA 1,
00-01-0427-46,INSTITUTO CIENTIFICO COMERCIAL EN COMPUTACION,CIUDAD CAPITAL,ZONA 1,
00-01-0443-46,INSTITUTO MIXTO NOCTURNO JOSE MARTI,CIUDAD CAPITAL,ZONA 1,
00-01-0444-46,INSTITUTO AMERICA,CIUDAD CAPITAL,ZONA 1,
00-01-0445-46,COLEGIO LICEO PEDRO PABLO VALDEZ,CIUDAD CAPITAL,ZONA 1,
00-01-0446-46,INSTITUTO BILINGUE ANGLOAMERICANO,CIUDAD CAPITAL,ZONA 1,
00-01-0447-46,CENTRO DE ESTUDIOS MERCADOLOGICOS Y PUBLICITARIOS,CIUDAD CAPITAL,ZONA 1,
00-01-0481-46,COLEGIO CERVANTES,CIUDAD CAPITAL,ZONA 1,
00-01-0483-46,LICEO METROPOLITANO SAN GREGORIO,CIUDAD CAPITAL,ZONA 1,
00-01-0491-46,CENTRO DE ENSENANZA INTEGRAL SISTEMATIZADA CEIS,CIUDAD CAPITAL,ZONA 1,
00-01-0492-46,INSTITUTO AMERICANO DE COMPUTACION,CIUDAD CAPITAL,ZONA 1,
00-01-0493-46,INSTITUTO DIVERSIFICADO BILINGUE CIAV,CIUDAD CAPITAL,ZONA 1,
00-01-0495-46,INSTITUTO MODELO,CIUDAD CAPITAL,ZONA 1,
00-01-0642-46,LICEO TECNOLOGICO MAYA DE GUATEMALA III,CIUDAD CAPITAL,ZONA 1,
00-01-0656-46,CENTRO EDUCACIONAL MIXTO PRIVADO KINGSTON,CIUDAD CAPITAL,ZONA 1,
00-01-0712-46,LICEO SANTIAGO,CIUDAD CAPITAL,ZONA 1,
00-01-0719-46,COLEGIO MIXTO CRISTIANO GUATEMALTECO,CIUDAD CAPITAL,ZONA 1,
00-01-0772-46,LICEO TECNOLOGICO MAYA DE GUATEMALA,CIUDAD CAPITAL,ZONA 1,
00-01-0982-46,INSTITUTO PRIVADO MIXTO DE EDUCACION DIVERSIFICADA ESCUELA EXPERIMENTAL DE APLICACION MIRON MUNOZ,CIUDAD CAPITAL,ZONA 1,
00-01-2462-46,INSTITUTO PRIVADO MIXTO DE EDUCACION DIVERSIFICADA RAFAEL LANDIVAR,CIUDAD CAPITAL,ZONA 1,
00-01-2464-46,INSTITUTO MIXTO RAFAEL LANDIVAR Y CABALLERO,CIUDAD CAPITAL,ZONA 1,
00-01-2473-46,INSTITUTO PRIVADO MIXTO DE EDUCACION DIVERSIFICADA LICEO PREUNIVERSITARIO DE COMPUTACION,CIUDAD CAPITAL,ZONA 1,
00-01-2474-46,INSTITUTO PRIVADO SUPERACION,CIUDAD CAPITAL,ZONA 1,
00-01-2799-46,INSTITUTO PRIVADO MIXTO DE EDUCACION DIVERSIFICADA COLEGIO EL PATRIARCA SAN JOSE,CIUDAD CAPITAL,ZONA 1,
00-01-2893-46,CENTRO DE ESTUDIOS Y SISTEMAS DE COMPUTACION C E S C,CIUDAD CAPITAL,ZONA 1,
00-01-2896-46,INSTITUTO PRIVADO MIXTO DE EDUCACION DIVERSIFICADA COLEGIO BROWN S,CIUDAD CAPITAL,ZONA 1,
00-01-2899-46,INSTITUTO PRIVADO DE BACHILLERATO POR MADUREZ PRACTICA COMERCIAL,CIUDAD CAPITAL,ZONA 1,
00-01-2902-46,INSTITUTO PROFESIONAL AMERICANO ROBERT GREGG,CIUDAD CAPITAL,ZONA 1,
00-01-2914-46,LICEO TECNICO EN COMPUTACION,CIUDAD CAPITAL,ZONA 1,
00-01-2952-46,INSTITUTO PRIVADO MIXTO DE EDUCACION DIVERSIFICADA COLEGIO BROWN S,CIUDAD CAPITAL,ZONA 1,
00-01-2953-46,INSTITUTO PRIVADO MIXTO COLEGIO BROWN S,CIUDAD CAPITAL,ZONA 1,
00-01-2954-46,INSTITUTO PRIVADO MIXTO DE EDUCACION DIVERSIFICADO DIEGUEZ OLAVERRI,CIUDAD CAPITAL,ZONA 1,
00-01-2980-46,INSTITUTO AMERICANO DE CONOCIMIENTOS,CIUDAD CAPITAL,ZONA 1,
00-01-2981-46,INSTITUTO AMERICANO DE CONOCIMIENTOS,CIUDAD CAPITAL,ZONA 1,
00-01-2983-46,COLEGIO DE COMPUTACION BLAISE PASCAL,CIUDAD CAPITAL,ZONA 1,
00-01-2984-46,COLEGIO DE COMPUTACION BLAISE PASCAL,CIUDAD CAPITAL,ZONA 1,
00-01-3006-46,CENTRO CULTURAL DE AMERICA,CIUDAD CAPITAL,ZONA 1,
00-01-3025-46,ESCUELA SUPERIOR DE INFORMATICA MARINA LOPEZ DE BAUTISTA,CIUDAD CAPITAL,ZONA 1,
00-01-3045-46,CENTRO DE ESTUDIOS TECNOLOGICOS TECNO PRO,CIUDAD CAPITAL,ZONA 1,
00-01-3046-46,INSTITUTO AMERICANO EN CIENCIAS DE COMPUTACION,CIUDAD CAPITAL,ZONA 1,
00-01-3047-46,COLEGIO DE CULTURA Y TECNOLOGIA C C T,CIUDAD CAPITAL,ZONA 1,
00-01-3050-46,INSTITUTO NORMAL PARA MAESTROS DE EDUCACION FISICA GOTTINGEN,CIUDAD CAPITAL,ZONA 1,
00-01-3085-46,COLEGIO PARA ADULTOS AHALCAB,CIUDAD CAPITAL,ZONA 1,
00-01-3087-46,INSTITUTO PRIVADO MIXTO DE EDUCACION DIVERSIFICADA LICEO PREUNIVERSITARIO DE COMPUTACION,CIUDAD CAPITAL,ZONA 1,
00-01-3095-46,COLEGIO RAMA ADULTA GUATEMALTECA DE DESEO ESTUDIANTIL RAGDE,CIUDAD CAPITAL,ZONA 1,
00-01-3157-46,LICEO DE CIENCIAS TECNICAS,CIUDAD CAPITAL,ZONA 1,
00-01-4010-46,ESCUELA SUPERIOR DE INFORMATICA,CIUDAD CAPITAL,ZONA 1,
00-01-4112-46,ESCUELA SISTEMATIZADA EN COMPUTACION,CIUDAD CAPITAL,ZONA 1,
00-01-4322-46,COLEGIO PRIVADO MIXTO CULTURA Y TECNOLOGIA CCT,CIUDAD CAPITAL,ZONA 1,
00-01-4348-46,INSTITUTO DE EDUCACION DIVERSIFICADA COLEGIO TECNICO SUPERIOR,CIUDAD CAPITAL,ZONA 1,
00-01-4350-46,INSTITUTO PRIVADO DE EDUCACION DIVERSIFICADA COLEGIO TECNICO SUPERIOR,CIUDAD CAPITAL,ZONA 1,
00-01-4393-46,INSTITUTO TECNICO SUPERIOR,CIUDAD CAPITAL,ZONA 1,
00-01-4401-46,LICEO GUATEMALTECO DE COMPUTACION,CIUDAD CAPITAL,ZONA 1,
00-01-4405-46,COLEGIO JOHANNES PAVLVS II,CIUDAD CAPITAL,ZONA 1,
00-01-4406-46,INSTITUTO AMERICANO EN CIENCIAS DE COMPUTACION,CIUDAD CAPITAL,ZONA 1,
00-01-4408-46,INSTITUTO GUATEMALTECO DE EDUCACION INTEGRAL PAIDOS,CIUDAD CAPITAL,ZONA 1,
00-01-4412-46,INSTITUTO DE BACHILLERATO POR MADUREZ FEDERICO CROWE,CIUDAD CAPITAL,ZONA 1,
00-01-4414-46,INSTITUTO PRIVADO MIXTO DE EDUCACION DIVERSIFICADA LICEO PREUNIVERSITARIO DE COMPUTACION,CIUDAD CAPITAL,ZONA 1,
00-01-4439-46,COLEGIO EVANGELICO HOGAR DE FE,CIUDAD CAPITAL,ZONA 1,
00-01-4457-46,COLEGIO INTERNACIONAL GUATEMALTECO,CIUDAD CAPITAL,ZONA 1,
00-01-4458-46,CENTRO DE FORMACION PROFESIONAL,CIUDAD CAPITAL,ZONA 1,
00-01-4553-46,INSTITUTO AMERICANO EN CIENCIAS DE COMPUTACION POR MADUREZ,CIUDAD CAPITAL,ZONA 1,
00-01-4555-46,INSTITUTO PARTICULARA MIXTO JOSE MARTI,CIUDAD CAPITAL,ZONA 1,
00-01-4609-46,COLEGIO INTERNACIONAL AMERICANO C I A,CIUDAD CAPITAL,ZONA 1,
00-01-4610-46,INSTITUTO PRIVADO MIXTO DE EDUCACION DIVERSIFICADA COLEGIO BROW S,CIUDAD CAPITAL,ZONA 1,
00-01-4612-46,INSTITUTO PRIVADO TECNICO AMERICANO,CIUDAD CAPITAL,ZONA 1,
00-01-4756-46,CENTRO CULTURAL DE AMERICA,CIUDAD CAPITAL,ZONA 1,
00-01-6915-46,ROYALTY ESCUELA INTERNACIONAL DE VIAJES TURISMO Y COMERCIO,CIUDAD CAPITAL,ZONA 1,
00-01-6916-46,COLEGIO MIXTO BILINGUE AMANECER,CIUDAD CAPITAL,ZONA 1,
00-01-6956-46,INSTITUTO POR MADUREZ SUPERACION,CIUDAD CAPITAL,ZONA 1,
00-01-6991-46,ESCUELA NACIONAL DE RADIOTELEGRAFIA,CIUDAD CAPITAL,ZONA 1,
00-01-7010-46,LICEO EN COMPUTACION IXCHEL,CIUDAD CAPITAL,ZONA 1,
00-01-7025-46,LICEO TECNICO COMERCIAL MIRAMUNDO,CIUDAD CAPITAL,ZONA 1,
00-01-7069-46,CENTRO INDUSTRIAL NO 2 ANEXO ESCUELA NO 11 J MARIANO GONZALEZ,CIUDAD CAPITAL,ZONA 1,
00-01-7096-46,LICEO MIXTO EN COMPUTACION IXCHEL,CIUDAD CAPITAL,ZONA 1,
00-01-7162-46,LICEO PROFESIONAL EN COMPUTACION Y CIENCIAS COMERCIALES,CIUDAD CAPITAL,ZONA 1,
00-01-7188-46,CENTRO PROFESIONAL DE ESTUDIOS EN COMPUTACION,CIUDAD CAPITAL,ZONA 1,
00-01-7285-46,COLEGIO MIXTO CATOLICO DE ESTUDIOS DE LA ADMINISTRACION SAN IYIGO,CIUDAD CAPITAL,ZONA 1,
00-01-7294-46,COLEGIO MAYBAL,CIUDAD CAPITAL,ZONA 1,
00-01-7326-46,CENTRO PROFESIONAL DE ESTUDIOS DE COMPUTACION,CIUDAD CAPITAL,ZONA 1,
00-01-7388-46,CENTRO DE ESTUDIOS COMERCIALES EN INFORMATICA,CIUDAD CAPITAL,ZONA 1,
00-01-7526-46,ESCUELA TECNICA CIENCIA APLICADA,CIUDAD CAPITAL,ZONA 1,
00-01-7632-46,CPUM COLEGIO PRIVADO MIXTO EN COMPUTACION VERSALLES,CIUDAD CAPITAL,ZONA 1,
00-01-7728-46,LICEO CLASICO EN COMPUTACION,CIUDAD CAPITAL,ZONA 1,
00-01-7744-46,COLEGIO MIXTO PADRE BETANZOS,CIUDAD CAPITAL,ZONA 1,
00-01-7814-46,COLEGIO O MEANY,CIUDAD CAPITAL,ZONA 1,
00-01-7820-46,COLEGIO SISTEMATIZADO EN COMPUTACION,CIUDAD CAPITAL,ZONA 1,
00-01-7821-46,COLEGIO SISTEMATIZADO EN COMPUTACION,CIUDAD CAPITAL,ZONA 1,
00-01-7840-46,LICEO PROFESIONAL DE INFORMATICA Y TECNOLOGIA,CIUDAD CAPITAL,ZONA 1,
00-01-8031-46,COLEGIO BILINGUE ESPECIALIZADO EN COMPUTACION YULIMAY PC,CIUDAD CAPITAL,ZONA 1,
00-01-8035-46,COLEGIO BILINGUE ESPECIALIZADO EN COMPUTACION YULIMAY PC,CIUDAD CAPITAL,ZONA 1,
00-01-8098-46,INSTITUTO FEDERICO CROWE,CIUDAD CAPITAL,ZONA 1,
00-01-8216-46,COLEGIO BILINGUE ESPECIALIZADO EN COMPUTACION YULIMAY PC,CIUDAD CAPITAL,ZONA 1,
00-01-8478-46,INSTITUTO CIENTIFICO COMERCIAL EN COMPUTACION POR MADUREZ,CIUDAD CAPITAL,ZONA 1,
00-01-8526-46,LICEO MONTECARLO,CIUDAD CAPITAL,ZONA 1,
00-01-8675-46,COLEGIO BILINGUE ESPECIALIZADO EN COMPUTACION YULIMAY PC POR MADUREZ,CIUDAD CAPITAL,ZONA 1,
00-01-8678-46,COLEGIO BILINGUE ESPECIALIZADO EN COMPUTACION YULIMAY PC POR MADUREZ,CIUDAD CAPITAL,ZONA 1,
00-01-8773-46,COLEGIO TECNICO DE COMERCIO,CIUDAD CAPITAL,ZONA 1,
00-01-9207-46,CENTRO EDUCATIVO EN COMPUTACION GENESIS,CIUDAD CAPITAL,ZONA 1,
00-01-9478-46,INSTITUTO DE DIBUJO Y PUBLICIDAD,CIUDAD CAPITAL,ZONA 1,
00-01-9635-46,CENTRO DE ESTUDIOS PREUNIVERSITARIOS DR BUCHNER,CIUDAD CAPITAL,ZONA 1,
00-01-9639-46,CENTRO DE ESTUDIOS PREUNIVERSITARIOS DR BUCHNER,CIUDAD CAPITAL,ZONA 1,
00-01-9688-46,COLEGIO PREUNIVERSITARIO DEL CENTRO HISTORICO,CIUDAD CAPITAL,ZONA 1,
00-01-9745-46,COLEGIO TECNICO RENOIR,CIUDAD CAPITAL,ZONA 1,
00-01-9792-46,COLEGIO GUATEMALA,CIUDAD CAPITAL,ZONA 1,
00-01-9803-46,INSTITUTO MODELO,CIUDAD CAPITAL,ZONA 1,
00-01-9804-46,LICEO PANAMERICANO,CIUDAD CAPITAL,ZONA 1,
00-01-9829-46,LICEO PANAMERICANO,CIUDAD CAPITAL,ZONA 1,
00-01-9830-46,COLEGIO SECRETARIAL GUATEMALTECO,CIUDAD CAPITAL,ZONA 1,
00-01-9831-46,LICEO JOSE DE SAN MARTIN,CIUDAD CAPITAL,ZONA 1,
00-01-9836-46,LICEO DE COMPUTACION SIGLO 21 NO 3,CIUDAD CAPITAL,ZONA 1,
00-02-0006-46,INSTITUTO CULTURAL AMERICANO,CIUDAD CAPITAL,ZONA 2,
00-02-0012-46,COLEGIO EVANGELICO MIXTO LA PATRIA,CIUDAD CAPITAL,ZONA 2,
00-02-0013-46,INSTITUTO MIXTO DE COMPUTACION IXCHEL,CIUDAD CAPITAL,ZONA 2,
00-02-0098-46,INSTITUTO CULTURAL AMERICANO,CIUDAD CAPITAL,ZONA 2,
00-02-0218-46,INSTITUTO PRIVADO PARA SENORITAS DE EDUCACION DIVERSIFICADA TECNICO AMERICANO,CIUDAD CAPITAL,ZONA 2,
00-02-0312-46,ESCUELA NACIONAL DE FORMACION SECRETARIAL NO 2,CIUDAD CAPITAL,ZONA 2,
00-02-0316-46,INSTITUTO PRIVADO MIXTO DE EDUCACION DIVERSIFICADA ESCUELA TECNICA DE TURISMO,CIUDAD CAPITAL,ZONA 2,
00-02-0319-46,INSTITUTO PRIVADO MIXTO DE EDUCACION DIVERSIFICADA COLEGIO CENTRO PEDAGOGICO EL VALLE,CIUDAD CAPITAL,ZONA 2,
00-02-3142-46,CENTRO EDUCATIVO CIENTIFICO DE INFORMATICA,CIUDAD CAPITAL,ZONA 2,
00-02-6926-46,CENTRO DE ESTUDIOS TECNOLOGICOS,CIUDAD CAPITAL,ZONA 2,
00-02-8071-46,CENTRO EDUCATIVO EN COMPUTACION GENESIS,CIUDAD CAPITAL,ZONA 2,
00-02-8281-46,COLEGIO EVANGELICO MIXTO LA PATRIA POR MADUREZ,CIUDAD CAPITAL,ZONA 2,
00-02-8427-46,INSTITUTO MIXTO PRIVADO JOSE ERNESTO MONZON,CIUDAD CAPITAL,ZONA 2,
00-02-8428-46,INSTITUTO MIXTO PRIVADO JOSE ERNESTO MONZON,CIUDAD CAPITAL,ZONA 2,
00-03-0002-46,COLEGIO MIXTO JUANA DE ARCO,CIUDAD CAPITAL,ZONA 3,
00-03-0015-46,CENTRO EDUCATIVO ALFASIC,CIUDAD CAPITAL,ZONA 3,
00-03-0364-46,INSTITUTO PRIVADO MIXTO DE EDUCACION DIVERSIFICADA CENTRO PROFESIONAL DE COMPUTACION,CIUDAD CAPITAL,ZONA 3,
00-03-0365-46,INSTITUTO PRIVADO MIXTO DE EDUCACION DIVERSIFICADA ESCUELA NORMAL JUANA DE ARCO,CIUDAD CAPITAL,ZONA 3,
00-03-0368-46,INSTITUTO PRIVADO MIXTO DE EDUCACION DIVERSIFICADA CENTRO PROFESIONAL DE COMPUTACION,CIUDAD CAPITAL,ZONA 3,
00-03-0371-46,INSTITUTO PRIVADO MIXTO DE EDUCACION DIVERSIFICADA ACADEMIA HALDA,CIUDAD CAPITAL,ZONA 3,
00-03-2787-46,INSTITUTO PRIVADO PARA SENORITAS DE EDUCACION DIVERSIFICADA EL HOGAR,CIUDAD CAPITAL,ZONA 3,
00-03-2909-46,COLEGIO MIXTO CRISTIANO GUATEMALTECO,CIUDAD CAPITAL,ZONA 3,
00-03-4639-46,COLEGIO MIXTO CRISTIANO GUATEMALTECO,CIUDAD CAPITAL,ZONA 3,
00-03-6938-46,EPUM CRISTIANA VIDA,CIUDAD CAPITAL,ZONA 3,
00-03-7028-46,COLEGIO KEPLER,CIUDAD CAPITAL,ZONA 3,
00-03-7038-46,EPUM CRISTIANA VIDA,CIUDAD CAPITAL,ZONA 3,
00-03-7057-46,LICEO DE CIENCIAS TECNICAS COMERCIALES Y DE COMPUTACION,CIUDAD CAPITAL,ZONA 3,
00-03-7059-46,LICEO DE CIENCIAS COMERCIALES Y DE COMPUTACION,CIUDAD CAPITAL,ZONA 3,
00-03-7144-46,EPRM CRISTIANA VIDA,CIUDAD CAPITAL,ZONA 3,
00-03-7607-46,LICEO BRASILENO,CIUDAD CAPITAL,ZONA 3,
00-03-8576-46,COLEGIO TECNICO MODERNO,CIUDAD CAPITAL,ZONA 3,
00-03-8581-46,COLEGIO TECNICO MODERNO,CIUDAD CAPITAL,ZONA 3,
00-03-9800-46,ESCUELA JUANA DE ARCO MIXTA,CIUDAD CAPITAL,ZONA 3,
00-04-0001-46,ESCUELA MILITAR DE AVIACION,CIUDAD CAPITAL,ZONA 4,
00-04-9791-46,ESCUELA DE CAPACITACION EN ADMINISTRACION MUNICIPAL ECAM,CIUDAD CAPITAL,ZONA 4,
00-05-0001-46,LICEO MIXTO DE EDUCACION INTEGRAL,CIUDAD CAPITAL,ZONA 5,
00-05-2912-46,LICEO MIXTO DE EDUCACION INTEGRAL,CIUDAD CAPITAL,ZONA 5,
00-05-2955-46,CENTRO ESTUDIANTIL DE ENSENANZA MEDIA,CIUDAD CAPITAL,ZONA 5,
00-05-3064-46,INSTITUTO NACIONAL DE FORMACION TECNICA,CIUDAD CAPITAL,ZONA 5,
00-05-3152-46,CENTRO INDUSTRIAL 6 ANEXO ESCUELA REPUBLICA DE LIBANO,CIUDAD CAPITAL,ZONA 5,
00-05-4528-46,INSTITUTO PARTICULAR MIXTO NOCTURNO GUATEMALA,CIUDAD CAPITAL,ZONA 5,
00-05-4564-46,CENTRO ESTUDIANTIL DE ENSENANZA MEDIA,CIUDAD CAPITAL,ZONA 5,
00-05-8587-46,INSTITUTO TECNICO NOCTURNO PROF LEONOR QUIROA DE MELGAR,CIUDAD CAPITAL,ZONA 5,
00-05-9794-46,INSTITUTO TECNICO FEMENINO,CIUDAD CAPITAL,ZONA 5,
00-05-9801-46,INSTITUTO MIXTO NOCTURNO JOSE BATRES MONTUFAR,CIUDAD CAPITAL,ZONA 5,
00-05-9827-46,LICEO PARTICULAR MIXTO EPISCOPAL,CIUDAD CAPITAL,ZONA 5,
00-06-0016-46,COLEGIO MIXTO PRESBITERO JULIO GONZALEZ CELIS,CIUDAD CAPITAL,ZONA 6,
00-06-0060-46,INSTITUTO MIXTO NOCTURNO POR COOPERATIVA MUNICIPAL BASICO Y BACHILLERATO POR MADUREZ DE CHINAUTLA,CIUDAD CAPITAL,ZONA 6,
00-06-2225-46,COLEGIO MIXTO NOCTURNO PBRO JULIO GONZALEZ CELIZ,CIUDAD CAPITAL,ZONA 6,
00-06-2913-46,COLEGIO MIXTO NOCTURNO PBRO JULIO GONZALEZ CELIS,CIUDAD CAPITAL,ZONA 6,
00-06-3016-46,CENTRO INDUSTRIAL NO 8 ANEXO ESCUELA RAFAEL AREVALO MARTINEZ,CIUDAD CAPITAL,ZONA 6,
00-06-3052-46,LICEO DE COMPUTACION C S S,CIUDAD CAPITAL,ZONA 6,
00-06-3139-46,CENTRO EDUCATIVO PAULO FREIRE,CIUDAD CAPITAL,ZONA 6,
00-06-4645-46,COLEGIO CENTRO PEDAGOGICO EL VALLE,CIUDAD CAPITAL,ZONA 6,
00-06-7601-46,COLEGIO MIXTO DE INFORMATICA Y DESARROLLO HUMANO PRINCIPAL MARIA,CIUDAD CAPITAL,ZONA 6,
00-06-8459-46,CENTRO DE COMPUTACION IMB PC NO 2,CIUDAD CAPITAL,ZONA 6,
00-06-9795-46,INSTITUTO NACIONAL DIVERSIFICADO VESPERTINO ENRIQUE GOMEZ CARRILLO CON ORIENTACION COMERCIAL,CIUDAD CAPITAL,ZONA 6,
00-06-9796-46,INSTITUTO NACIONAL DIVERSIFICADO VESPERTINO ROMULO GALLEGOS FREIRE CON ORIENTACION COMERCIAL,CIUDAD CAPITAL,ZONA 6,
00-06-9809-46,INSTITUTO MIXTO PRIVADO JOSE ERNESTO MONZON,CIUDAD CAPITAL,ZONA 6,
00-07-0003-46,LICEO TECNICO COMERCIAL MIRAMUNDO,CIUDAD CAPITAL,ZONA 7,
00-07-0004-46,LICEO TECNICO COMERCIAL MIRAMUNDO,CIUDAD CAPITAL,ZONA 7,
00-07-0017-46,INSTITUTO MIXTO MIGUEL ANGEL ASTURIAS,CIUDAD CAPITAL,ZONA 7,
00-07-0018-46,INSTITUTO PRIVADO ALBERT EINSTEIN,CIUDAD CAPITAL,ZONA 7,
00-07-0019-46,INSTITUTO MIXTO LANDIVAR,CIUDAD CAPITAL,ZONA 7,
00-07-0020-46,ESCUELA NACIONAL DE CIENCIAS COMERCIALES NUMERO 2,CIUDAD CAPITAL,ZONA 7,
00-07-0260-46,COLEGIO PRE UNIVERSITARIO CATOLICO DE GUATEMALA,CIUDAD CAPITAL,ZONA 7,
00-07-0272-46,LICEO TECNICO DE CIENCIA Y TECNOLOGIA,CIUDAD CAPITAL,ZONA 7,
00-07-1696-46,INSTITUTO PRIVADO PARA SENORITAS DE EDUCACION DIVERSIFICADA COLEGIO MONTE REAL,CIUDAD CAPITAL,ZONA 7,
00-07-2497-46,INSTITUTO PRIVADO MIXTO DE EDUCACION DIVERSIFICADA LICEO TECNICO COMERCIAL BILINGUE MIRAMUNDO,CIUDAD CAPITAL,ZONA 7,
00-07-2511-46,INSTITUTO PRIVADO MIXTO DE EDUCACION DIVERSIFICADA COLEGIO PRE UNIVERSITARIO CATOLICO DE GUATEMALA,CIUDAD CAPITAL,ZONA 7,
00-07-2808-46,COLEGIO CENTRO EDUCATIVO JUVENIL SUPERACION,CIUDAD CAPITAL,ZONA 7,
00-07-2956-46,ESCUELA TECNICA DE DIBUJO EN CONSTRUCCION GUATEMALA,CIUDAD CAPITAL,ZONA 7,
00-07-2960-46,COLEGIO CRISTIANO ELIM,CIUDAD CAPITAL,ZONA 7,
00-07-4005-46,INSTITUTO PRIVADO MIXTO DE EDUCACION DIVERSIFICADA COLEGIO PRE UNIVERSITARIO CA,CIUDAD CAPITAL,ZONA 7,
00-07-4325-46,INSTITUTO TECNICO EN ELECTRICIDAD Y DIBUJO DE CONSTRUCCION,CIUDAD CAPITAL,ZONA 7,
00-07-4330-46,INSTITUTO TECNICO VOCACIONAL CENTRO AMERICANO BILINGUE,CIUDAD CAPITAL,ZONA 7,
00-07-4438-46,COLEGIO DE BASICO Y BACHILLERATO POR MADUREZ AMERICA,CIUDAD CAPITAL,ZONA 7,
00-07-4529-46,COLEGIO MIXTO SANTA CATALINA,CIUDAD CAPITAL,ZONA 7,
00-07-4565-46,INSTITUTO TECNICO VOCACIONAL,CIUDAD CAPITAL,ZONA 7,
00-07-4623-46,ESCUELA DE CIENCIAS COMERCIALES ADSC AL INEB MIGUEL GARCIA G,CIUDAD CAPITAL,ZONA 7,
00-07-4651-46,COLEGIO MIXTO VICTORIA,CIUDAD CAPITAL,ZONA 7,
00-07-6907-46,LICEO AMERICANO TECNOLOGICO DE COMPUTACION,CIUDAD CAPITAL,ZONA 7,
00-07-7413-46,COLEGIO MIXTO AMSTERDAM,CIUDAD CAPITAL,ZONA 7,
00-07-8442-46,COLEGIO PANAMERICANO NO 4,CIUDAD CAPITAL,ZONA 7,
00-07-8550-46,INSTITUTO PRIVADO MIXTO EL MAESTRO AMIGO,CIUDAD CAPITAL,ZONA 7,
00-07-8593-46,CENTRO EDUCATIVO LOS SAUCES,CIUDAD CAPITAL,ZONA 7,
00-07-8793-46,COLEGIO EXPERIMENTAL CRISTIANO VERBO NO 2,CIUDAD CAPITAL,ZONA 7,
00-07-8913-46,INSTITUTO DE DIVERSIFICADO DE BACHILLERATO EN MERCADOTECNIA ADS A INEB BETHANIA,CIUDAD CAPITAL,ZONA 7,
00-07-8956-46,INSTITUTO REFCO,CIUDAD CAPITAL,ZONA 7,
00-07-8966-46,COLEGIO SAN JUAN DE TURIN,CIUDAD CAPITAL,ZONA 7,
00-07-9059-46,COLEGIO MIXTO SAN JOSE,CIUDAD CAPITAL,ZONA 7,
00-07-9429-46,CENTRO EDUCATIVO TECNICO EN COMPUTACION II CETEC,CIUDAD CAPITAL,ZONA 7,
00-07-9617-46,LICEO CRISTIANO CAMINO DEL SABER,CIUDAD CAPITAL,ZONA 7,
00-08-3148-46,CENTRO DEL HOGAR NO 4 ANEXO A EOUN NO 14 SANTOS TORUNO,CIUDAD CAPITAL,ZONA 8,
00-08-7062-46,ACADEMIA DE CORTE Y CONFECCION EL ARTE,CIUDAD CAPITAL,ZONA 8,
00-08-7063-46,ACADEMIA DE CORTE Y CONFECCION EL ARTE,CIUDAD CAPITAL,ZONA 8,
00-09-0692-46,INSTITUTO PRIVADO PARA VARONES DE EDUCACION DIVERSIFICADA ESCUELA PREPARATORIA ANEXA,CIUDAD CAPITAL,ZONA 9,
00-09-0694-46,INSTITUTO PRIVADO MIXTO DE EDUCACION DIVERSIFICADA COLEGIO CIENTIFICO INTEGRADO EN COMPUTACION,CIUDAD CAPITAL,ZONA 9,
00-09-0768-46,INSTITUTO PRIVADO MIXTO DE EDUCACION DIVERSIFICADA COLEGIO NIM BEI,CIUDAD CAPITAL,ZONA 9,
00-09-2244-46,INSTITUTO PRIVADO PARA SENORITAS DE EDUCACION DIVERSIFICADA COLEGIO ROSEMONT,CIUDAD CAPITAL,ZONA 9,
00-09-7372-46,INSTITUTO ANGLO GUATEMALTECO DE RELACIONES CULTURALES,CIUDAD CAPITAL,ZONA 9,
00-09-8392-46,COLEGIO SAN INIGO,CIUDAD CAPITAL,ZONA 9,
00-10-0002-46,INSTITUTO DE BACHILLERATO EN CIENCIAS DE LA COMPUTACION ADSCRITO AL INSTITUTO INTERNACIONAL PARA ESTUDIO DE COMPUTADORAS,CIUDAD CAPITAL,ZONA 10,
00-10-0003-46,INSTITUTO ANGELICA ROSA,CIUDAD CAPITAL,ZONA 10,
00-10-0005-46,CENTRO EDUCACIONAL VIDES,CIUDAD CAPITAL,ZONA 10,
00-10-0006-46,COLEGIO PIERMOUNT,CIUDAD CAPITAL,ZONA 10,
00-10-0022-46,COLEGIO BELMONT,CIUDAD CAPITAL,ZONA 10,
00-10-0765-46,INSTITUTO PRIVADO PARA SENORITAS DE EDUCACION DIVERSIFICADA LICEO SECRETARIAL BILINGUE,CIUDAD CAPITAL,ZONA 10,
00-10-0766-46,INSTITUTO PRIVADO PARA SENORITAS DE EDUCACION DIVERSIFICADA COLEGIO WHITMAN,CIUDAD CAPITAL,ZONA 10,
00-10-0772-46,INSTITUTO PRIVADO MIXTO DE EDUCACION DIVERSIFICADA COLEGIO AMERICANO BILINGUE CENTRO A B C,CIUDAD CAPITAL,ZONA 10,
00-10-0773-46,INSTITUTO PRIVADO MIXTO DE EDUCACION DIVERSIFICADA FEDERICO VON HAYEK,CIUDAD CAPITAL,ZONA 10,
00-10-0774-46,INSTITUTO PRIVADO MIXTO DE EDUCACION DIVERSIFICADA COLEGIO NALEB,CIUDAD CAPITAL,ZONA 10,
00-10-0776-46,INSTITUTO PRIVADO MIXTO DE EDUCACION DIVERSIFICADA LICEO MINERVA,CIUDAD CAPITAL,ZONA 10,
00-10-2520-46,INSTITUTO PRIVADO MIXTO DE EDUCACION DIVERSIFICADA COLEGIO MARKAM,CIUDAD CAPITAL,ZONA 10,
00-10-2523-46,COLEGIO EL PUENTE,CIUDAD CAPITAL,ZONA 10,
00-10-4017-46,INSTITUTO TECNICO FEMENINO NOCTURNO,CIUDAD CAPITAL,ZONA 10,
00-10-4653-46,CENTRO DE CAPACITACION Y COLEGIO CRISTIANO BILINGUE EMET VERDAD,CIUDAD CAPITAL,ZONA 10,
00-10-7185-46,INSTITUTO DE TECNOLOGIA MEDICA AMEDESGUA,CIUDAD CAPITAL,ZONA 10,
00-10-7186-46,INSTITUTO DE TECNOLOGIA MEDICA AMEDESGUA,CIUDAD CAPITAL,ZONA 10,
00-10-7534-46,COLEGIO TECNOLOGICO CREATIVO LOS PROCERES,CIUDAD CAPITAL,ZONA 10,
00-10-8629-46,COLEGIO AMERICANO PREUNIVERSITARIO,CIUDAD CAPITAL,ZONA 10,
00-11-0004-46,COLEGIO MIXTO JOSE CECILIO DEL VALLE,CIUDAD CAPITAL,ZONA 11,
00-11-0009-46,COLEGIO BILINGUE MONTE AMERICANO,CIUDAD CAPITAL,ZONA 11,
00-11-0859-46,INSTITUTO PRIVADO MIXTO DE EDUCACION DIVERSIFICADA LICEO LAFAYETTE,CIUDAD CAPITAL,ZONA 11,
00-11-0860-46,INSTITUTO PRIVADO MIXTO DE EDUCACION DIVERSIFICADA COLEGIO BILINGUE SANTA MARIA,CIUDAD CAPITAL,ZONA 11,
00-11-2357-46,COLEGIO PROFESIONAL EN COMPUTACION S A,CIUDAD CAPITAL,ZONA 11,
00-11-2537-46,INSTITUTO PRIVADO MIXTO DE EDUCACION DIVERSIFICADA COLEGIO PROFESIONAL EN COMPUTACION S A,CIUDAD CAPITAL,ZONA 11,
00-11-2538-46,INSTITUTO PRIVADO MIXTO DE EDUCACION DIVERSIFICADA CENTRO EDUCATIVO ELIZARDO URIZAR LEAL PLAN SABATINO,CIUDAD CAPITAL,ZONA 11,
00-11-2938-46,COLEGIO MIXTO BILINGUE SANTA MARIA,CIUDAD CAPITAL,ZONA 11,
00-11-3073-46,COLEGIO MIXTO BILINGUE LAS AMERICAS,CIUDAD CAPITAL,ZONA 11,
00-11-3102-46,COLEGIO INTEGRAL GUATEMALTECO DIVERSIFICADO,CIUDAD CAPITAL,ZONA 11,
00-11-3122-46,LICEO ALPHA,CIUDAD CAPITAL,ZONA 11,
00-11-3137-46,CENTRO PROFESIONAL DE ESTUDIOS EN COMPUTACION,CIUDAD CAPITAL,ZONA 11,
00-11-8418-46,LICEO BILINGUE LAS NACIONES,CIUDAD CAPITAL,ZONA 11,
00-11-8876-46,COLEGIO SAN BORJA,CIUDAD CAPITAL,ZONA 11,
00-11-9211-46,COLEGIO AMERICANO PREUNIVERSITARIO,CIUDAD CAPITAL,ZONA 11,
00-11-9799-46,COLEGIO MIXTO DIURNO FRANKLIN DELANO ROOSEVELT,CIUDAD CAPITAL,ZONA 11,
00-11-9828-46,CENTRO EDUCACIONAL DE ESTUDIOS ECONOMICO ADMINISTRATIVOS,CIUDAD CAPITAL,ZONA 11,
00-12-0004-46,CENTRO EDUCATIVO IMB PC EN LINEA IMB PC ONLINE,CIUDAD CAPITAL,ZONA 12,
00-12-0005-46,CENTRO EDUCATIVO IMB PC EN LINEA IMB PC ONLINE,CIUDAD CAPITAL,ZONA 12,
00-12-0008-46,CENTRO EDUCATIVO IMB PC EN LINEA IMB PC ONLINE,CIUDAD CAPITAL,ZONA 12,
00-12-0010-46,CENTRO EDUCATIVO IMB PC EN LINEA IMB PC ONLINE,CIUDAD CAPITAL,ZONA 12,
00-12-0013-46,COLEGIO EVANGELICO LUMINARES,CIUDAD CAPITAL,ZONA 12,
00-12-0909-46,INSTITUTO PRIVADO MIXTO DE EDUCACION DIVERSIFICADA COLEGIO FRANCISCANO 12 DE OCTUBRE,CIUDAD CAPITAL,ZONA 12,
00-12-0910-46,INSTITUTO PRIVADO MIXTO DE EDUCACION DIVERSIFICADA TECNICO MARCO POLO,CIUDAD CAPITAL,ZONA 12,
00-12-3002-46,COLEGIO PROFESIONAL EN COMPUTACION S A,CIUDAD CAPITAL,ZONA 12,
00-12-3130-46,COLEGIO PROFESIONAL EN COMPUTACION S A,CIUDAD CAPITAL,ZONA 12,
00-12-3132-46,COLEGIO MIXTO OSORIO SANDOVAL,CIUDAD CAPITAL,ZONA 12,
00-12-4659-46,COLEGIO MIXTO Y ACADEMIA HALDA,CIUDAD CAPITAL,ZONA 12,
00-12-6247-46,CENTRO INDUSTRIAL NO 3 ADSC A EOUM NO 75 FUERZA AEREA GUATEMALTECA,CIUDAD CAPITAL,ZONA 12,
00-12-6963-46,INSTITUTO DE EDUCACION BASICA Y BACHILLERATO EN CIENCIAS Y LETRAS POR MADUREZ,CIUDAD CAPITAL,ZONA 12,
00-12-8567-46,INSTITUTO DIVERSIFICADO MIRNA MACK,CIUDAD CAPITAL,ZONA 12,
00-13-0010-46,INSTITUTO DE BACHILLERATO CENTROAMERICANO IBCA,CIUDAD CAPITAL,ZONA 13,
00-13-0947-46,INSTITUTO DE BACHILLERATO POR MADUREZ ADSC A ESCUELA TECNICA DE AVIACION,CIUDAD CAPITAL,ZONA 13,
00-13-2558-46,INSTITUTO PRIVADO MIXTO DE EDUCACION DIVERSIFICADA COLEGIO KARL FRIEDRICH GAUSS,CIUDAD CAPITAL,ZONA 13,
00-13-7903-46,ESCUELA DE COMUNICACIONES Y ELECTRONICA,CIUDAD CAPITAL,ZONA 13,
00-13-8380-46,COLEGIO MARKAM,CIUDAD CAPITAL,ZONA 13,
00-13-8870-46,,CIUDAD CAPITAL,ZONA 13,
00-13-9682-46,INSTITUTO DE BACHILLERATO EN COMPUTACION IBC,CIUDAD CAPITAL,ZONA 13,
00-13-9797-46,INSTITUTO MIXTO NOCTURNO FLAVIO HERRERA,CIUDAD CAPITAL,ZONA 13,
00-14-0958-46,INSTITUTO PRIVADO MIXTO DE EDUCACION DIVERSIFICADA COLEGIO GUATEMALTECO BILINGUE,CIUDAD CAPITAL,ZONA 14,
