CODIGO,ESTABLECIMIENTO,DEPARTAMENTO,MUNICIPIO,TELEFONO
00-14-0959-46,INSTITUTO PRIVADO MIXTO DE EDUCACION DIVERSIFICADA COLEGIO METROPOLITANO,CIUDAD CAPITAL,ZONA 14,
00-14-2578-46,INSTITUTO PRIVADO MIXTO DE EDUCACION DIVERSIFICADA TECNICO COMERCIAL BILINGUE,CIUDAD CAPITAL,ZONA 14,
00-14-8943-46,COLEGIO HERALDO DEL EVANGELIO,CIUDAD CAPITAL,ZONA 14,
00-14-8945-46,COLEGIO HERALDO DEL EVANGELIO,CIUDAD CAPITAL,ZONA 14,
00-15-2301-46,INSTITUTO PRIVADO MIXTO DE EDUCACION DIVERSIFICADA COLEGIO ALEJANDRO FLEMING,CIUDAD CAPITAL,ZONA 15,
00-16-0005-46,ESCUELA EXPERIMENTAL DE APLICACION MIRON MUNOZ,CIUDAD CAPITAL,ZONA 16,
00-17-2302-46,INSTITUTO PRIVADO MIXTO DE EDUCACION DIVERSIFICADA COLEGIO BILINGUE LOURDES,CIUDAD CAPITAL,ZONA 17,
00-17-7001-46,COLEGIO PEDAGOGICO EL VALLE,CIUDAD CAPITAL,ZONA 17,
00-17-9771-46,COLEGIO PANAMERICANO,CIUDAD CAPITAL,ZONA 17,
00-18-0070-46,CENTRO EDUCATIVO INMACULADA CONCEPCION,CIUDAD CAPITAL,ZONA 18,
00-18-1067-46,INSTITUTO PRIVADO MIXTO DE EDUCACION DIVERSIFICADA COLEGIO INDIRA GANDHI,CIUDAD CAPITAL,ZONA 18,
00-18-1068-46,INSTITUTO PRIVADO MIXTO DE EDUCACION DIVERSIFICADA JOSEFINA ANTILLON MILLA,CIUDAD CAPITAL,ZONA 18,
00-18-1069-46,INSTITUTO PRIVADO MIXTO DE EDUCACION DIVERSIFICADA CENTRO EDUCATIVO INTEGRAL GIRON ALFARO C E I G A,CIUDAD CAPITAL,ZONA 18,
00-18-1071-46,INSTITUTO PRIVADO MIXTO DE EDUCACION DIVERSIFICADA ALVARO CONTRERAS VELEZ,CIUDAD CAPITAL,ZONA 18,
00-18-2187-46,INSTITUTO PRIVADO MIXTO DE EDUCACION DIVERSIFICADA CENTRO EDUCATIVO INTEGRAL GIRON ALFARO CEIGA BACHILLERATO POR MADUREZ,CIUDAD CAPITAL,ZONA 18,
00-18-2918-46,INSTITUTO PRIVADO MIXTO DE EDUCACION DIVERSIFICADO COLEGIO LICEO LAS COLINAS,CIUDAD CAPITAL,ZONA 18,
00-18-6955-46,COLEGIO EVANGELICO HOGAR DE FE,CIUDAD CAPITAL,ZONA 18,
00-18-7238-46,LICEO DE CIENCIAS Y TECNICAS DE COMPUTACION,CIUDAD CAPITAL,ZONA 18,
00-18-7658-46,LICEO AMERICANO TECNOLOGICO EN COMPUTACION,CIUDAD CAPITAL,ZONA 18,
00-18-8063-46,COLEGIO MIXTO SENDA DEL SABER,CIUDAD CAPITAL,ZONA 18,
00-18-8866-46,CENTRO EDUCATIVO SAN JOSE,CIUDAD CAPITAL,ZONA 18,
00-19-0015-46,COLEGIO CRISTIANO AVIVAMIENTO,CIUDAD CAPITAL,ZONA 19,
00-19-1099-46,INSTITUTO PRIVADO MIXTO DE EDUCACION DIVERSIFICADA COLEGIO NUESTRA SENORA DE LA MEDALLA MILAGROSA,CIUDAD CAPITAL,ZONA 19,
00-19-8013-46,COLEGIO TECNOLOGICO INDUSTRIAL,CIUDAD CAPITAL,ZONA 19,
00-19-9793-46,INSTITUTO DIVERSIFICADO ADSCRITO AL INSTITUTO EXPERIMENTAL DE EDUCACION MEDIA SIMON BOLIVAR,CIUDAD CAPITAL,ZONA 19,
00-21-7067-46,CENTRO INDUSTRIAL JOSE FELIPE FLORES ANEXO A EOUN REPUBLICA DE VENEZUELA,CIUDAD CAPITAL,ZONA 21,
00-21-7974-46,COLEGIO OSORIO SANDOVAL,CIUDAD CAPITAL,ZONA 21,
00-21-7975-46,COLEGIO OSORIO SANDOVAL,CIUDAD CAPITAL,ZONA 21,
00-24-9632-46,CENTRO EDUCATIVO EN COMPUTACION GENESIS,CIUDAD CAPITAL,ZONA 24,
02-01-0038-46,INSTITUTO DE EDUCACION MEDIA POR MADUREZ,EL PROGRESO,GUASTATOYA,
02-01-0230-46,CENTRO EDUCATIVO GUAYACAN,EL PROGRESO,GUASTATOYA,
02-02-0005-46,INSTITUTO NACIONAL DE EDUCACION DIVERSIFICADO MORAZAN,EL PROGRESO,MORAZAN,
02-03-0023-46,INSTITUTO NACIONAL DE EDUCACION DIVERSIFICADA,EL PROGRESO,SAN AGUSTIN ACASAGUASTLAN,
02-03-0102-46,LICEO SAN JOSE,EL PROGRESO,SAN AGUSTIN ACASAGUASTLAN,
02-03-0136-46,CENTRO EDUCATIVO PRIVADO MIXTO INNOVADOR,EL PROGRESO,SAN AGUSTIN ACASAGUASTLAN,
02-03-0283-46,COLEGIO PRIVADO MIXTO EL ROSARIO,EL PROGRESO,SAN AGUSTIN ACASAGUASTLAN,
02-03-0614-46,INSTITUTO GUATEMALTECO DE EDUCACION RADIOFONICA IGER,EL PROGRESO,SAN AGUSTIN ACASAGUASTLAN,
02-04-0005-46,INSTITUTO NACIONAL DE EDUCACION DIVERSIFICADA,EL PROGRESO,SAN CRISTOBAL ACASAGUASTLAN,
02-05-0018-46,INSTITUTO NACIONAL TECNOLOGICO DE EDUCACION DIVERSIFICADA DE EL JICARO,EL PROGRESO,EL JICARO,
02-05-0132-46,ESCUELA PARTICULAR MIXTA DE CIENCIAS COMERCIALES,EL PROGRESO,EL JICARO,
02-05-0251-46,INSTITUTO DE EDUCACION BACHILLERATO POR MADUREZ,EL PROGRESO,EL JICARO,
02-05-0453-46,CENTRO EDUCATIVO CON ORIENTACION AMBIENTAL PROFESOR JOSE GUILLERMO SANTOS HERRARTE,EL PROGRESO,EL JICARO,
02-05-0592-46,COLEGIO DIVERSIFICADO EL JICARO,EL PROGRESO,EL JICARO,
02-06-0004-46,INSTITUTO NACIONAL DE EDUCACION DIVERSIFICADA,EL PROGRESO,SANSARE,
02-06-0006-46,INSTITUTO NACIONAL DE EDUCACION DIVERSIFICADA,EL PROGRESO,SANSARE,
02-07-0008-46,INSTITUTO NACIONAL DE EDUCACION DIVERSIFICADA,EL PROGRESO,SANARATE,
02-07-0265-46,CENTRO DE ESTUDIOS Y APLICACIONES EN COMPUTACION CEAC,EL PROGRESO,SANARATE,
02-07-0433-46,COLEGIO VESPERTINO MIXTO LA ASUNCION,EL PROGRESO,SANARATE,
02-07-0438-46,COLEGIO VESPERTINO MIXTO LA ASUNCION,EL PROGRESO,SANARATE,
02-07-0566-46,COLEGIO SAGRADO CORAZON DE JESUS,EL PROGRESO,SANARATE,
02-07-0754-46,COLEGIO PRIVADO MIXTO DE CIENCIAS COMERCIALES SANARATE,EL PROGRESO,SANARATE,
02-08-0535-46,INSTITUTO DIVERSIFICADO POR COOPERATIVA,EL PROGRESO,SAN ANTONIO LA PAZ,
01-01-0007-46,COLEGIO HAN AL AMERICANO,GUATEMALA,GUATEMALA,
01-01-0018-46,LICEO ROMANO AMERICANO,GUATEMALA,GUATEMALA,
01-01-2888-46,CENTRO MIXTO EDUCATIVO EMILENO,GUATEMALA,GUATEMALA,
01-01-2911-46,INSTITUTO MIXTO ANA CATALINA SOBERANIS REYES,GUATEMALA,GUATEMALA,
01-01-3061-46,CENTRO DE ESTUDIOS TECNOLOGICOS,GUATEMALA,GUATEMALA,
01-02-6941-46,INSTITUTO PARTICULAR MIXTO APLICADO EN COMPUTACION ANDRES FILIPPI,GUATEMALA,SANTA CATARINA PINULA,
01-02-7508-46,INSTITUTO PARTICULAR MIXTO APLICADO EN COMPUTACION ANDRES FILIPPI,GUATEMALA,SANTA CATARINA PINULA,
01-02-9748-46,COLEGIO ARRAYANES,GUATEMALA,SANTA CATARINA PINULA,
01-03-0038-46,INSTITUTO EN COMPUTACION SAN JOSE PINULA,GUATEMALA,SAN JOSE PINULA,
01-03-9181-46,COLEGIO EDUCARE JIREH,GUATEMALA,SAN JOSE PINULA,
01-05-2393-46,INSTITUTO PRIVADO MIXTO DE EDUCACION DIVERSIFICADA DR FRANCISCO ESCOBAR PEREZ,GUATEMALA,PALENCIA,
01-05-4106-46,COLEGIO CAMPO VERDE,GUATEMALA,PALENCIA,
01-06-0061-46,INSTITUTO NACIONAL PC BRENDA ELIZABETH DEL CID MEDRANO,GUATEMALA,CHINAUTLA,
01-06-0075-46,INSTITUTO NACIONAL MARIA FERNANDA MEDRANO CORDON,GUATEMALA,CHINAUTLA,
01-06-2334-46,INSTITUTO PRIVADO MIXTO DE EDUCACION DIVERSIFICADA CENTRO EDUCATIVO PAULO FREIRE,GUATEMALA,CHINAUTLA,
01-06-3001-46,INSTITUTO MUNICIPAL MIXTO NOCTURNO BASICO Y BACHILLERATO POR MADUREZ DE CHINAUTLA,GUATEMALA,CHINAUTLA,
01-06-7085-46,INSTITUTO MIXTO DE EDUCACION BASICA POR COOPERATIVA,GUATEMALA,CHINAUTLA,
01-06-8876-46,INSTITUTO PARTICULAR MIXTO NOCTURNO DR EPAMINONDAS QUINTANA,GUATEMALA,CHINAUTLA,
01-06-9313-46,LICEO NAVARRA SOCIEDAD ANONIMA,GUATEMALA,CHINAUTLA,
01-08-0010-46,INSTITUTO EDUCATIVO ASISTENCIAL EMILIANI Y HOGAR DE HUERFANOS SANTA TERESA,GUATEMALA,MIXCO,
01-08-0023-46,LICEO MIXTO JUVENTUD GUATEMALTECA,GUATEMALA,MIXCO,
01-08-0032-46,INSTITUTO ELITECH,GUATEMALA,MIXCO,
01-08-0079-46,COLEGIO INTEGRAL COMPETITIVO,GUATEMALA,MIXCO,
01-08-0087-46,LICEO MIXTO NOCTURNO TECNICO MERCANTIL,GUATEMALA,MIXCO,
01-08-0088-46,COLEGIO MIXTO EL QUETZAL,GUATEMALA,MIXCO,
01-08-0094-46,INSTITUTO DE EDUCACION BASICA DOCTOR THEO BLOEM,GUATEMALA,MIXCO,
01-08-0221-46,INSTITUTO PRIVADO ABRAHAM LINCOLN,GUATEMALA,MIXCO,
01-08-0276-46,ESCUELA DE SISTEMAS EN INFORMATICA ZONA 19,GUATEMALA,MIXCO,
01-08-0858-46,INSTITUTO PRIVADO MIXTO DE EDUCACION DIVERSIFICADA LICEO COEDUCATIVO PAABANC,GUATEMALA,MIXCO,
01-08-1030-46,COLEGIO CRISTIANO ELIM,GUATEMALA,MIXCO,
01-08-1719-46,ESCUELA TECNICA VOCACIONAL DE HOTELERIA Y HOGAR ALUX,GUATEMALA,MIXCO,
01-08-1724-46,INSTITUTO PRIVADO PARA SENORITAS DE EDUCACION DIVERSIFICADA SAN AGUSTIN,GUATEMALA,MIXCO,
01-08-1734-46,INSTITUTO PRIVADO MIXTO DE EDUCACION DIVERSIFICADA COLEGIO EVANGELICO HEBRON,GUATEMALA,MIXCO,
01-08-1736-46,INSTITUTO PRIVADO MIXTO DE EDUCACION DIVERSIFICADA LOURDES,GUATEMALA,MIXCO,
01-08-1738-46,INSTITUTO PRIVADO MIXTO DE EDUCACION DIVERSIFICADA PAMAXAN,GUATEMALA,MIXCO,
01-08-2420-46,INSTITUTO PRIVADO PARA SENORITAS DE EDUCACION DIVERSIFICADA LICEO TECNICO COMERCIAL SANTA LUCIA,GUATEMALA,MIXCO,
01-08-2774-46,INSTITUTO PRIVADO MIXTO DE EDUCACION DIVERSIFICADA LICEO TECNICO COMERCIAL Y ACADEMIA SANTA LUCIA,GUATEMALA,MIXCO,
01-08-2889-46,INSTITUTO DE EDUCACION BASICA Y BACHILLERATO POR MADUREZ SUPERAR Y TRIUNFAR,GUATEMALA,MIXCO,
01-08-2891-46,LICEO COEDUCATIVO GUATEMALTECO,GUATEMALA,MIXCO,
01-08-2899-46,LICEO MARIA INMACULADA,GUATEMALA,MIXCO,
01-08-2900-46,LICEO MARIA INMACULADA,GUATEMALA,MIXCO,
01-08-2912-46,INSTITUTO PRIVADO MIXTO CENTRO PEDAGOGICO SAN FRANCISCO,GUATEMALA,MIXCO,
01-08-2914-46,CENTRO PEDAGOGICO SAN FRANCISCO,GUATEMALA,MIXCO,
01-08-2975-46,SAN LUIS GOZAGA,GUATEMALA,MIXCO,
01-08-2976-46,INSTITUTO PRIVADO MIXTO EL HOGAR,GUATEMALA,MIXCO,
01-08-4164-46,COLEGIO PRIVADO MIXTO EL JARDIN DEL EDEN,GUATEMALA,MIXCO,
01-08-4231-46,CENTRO EDUCATIVO CRISTIANO JERUSALEM,GUATEMALA,MIXCO,
01-08-4547-46,COLEGIO MODERNO DE COMPUTACION C M C,GUATEMALA,MIXCO,
01-08-6198-46,INSTITUTO DE EDUCACION DIVERSIFICADA COLEGIO SAN JOSE DE LOS INFANTES,GUATEMALA,MIXCO,
01-08-6285-46,COLEGIO CENTRO EDUCATIVO JUVENIL SUPERACION,GUATEMALA,MIXCO,
01-08-6513-46,LICEO CRISTIANO CAMINO DEL SABER,GUATEMALA,MIXCO,
01-08-6584-46,CENTRO CULTURAL DE AMERICA,GUATEMALA,MIXCO,
01-08-6659-46,LICEO SALAMANCA,GUATEMALA,MIXCO,
01-08-6675-46,COLEGIO SAN JOSE DE LOS INFANTES,GUATEMALA,MIXCO,
01-08-6816-46,COLEGIO MIXTO MONTE REAL,GUATEMALA,MIXCO,
01-08-6850-46,CENTRO EDUCATIVO CARLOS MERIDA,GUATEMALA,MIXCO,
01-08-7238-46,COLEGIO FUTURO AMANECER,GUATEMALA,MIXCO,
01-08-7252-46,CENTRO EDUCATIVO CARLOS MERIDA,GUATEMALA,MIXCO,
01-08-7253-46,CENTRO EDUCATIVO CARLOS MERIDA,GUATEMALA,MIXCO,
01-08-7266-46,ESCUELA EXPERIMENTAL DE APLICACION MIRON MUNOZ,GUATEMALA,MIXCO,
01-08-7471-46,LICEO MIXTO EL PORVENIR,GUATEMALA,MIXCO,
01-08-7668-46,IPMB JOSE JOAQUIN PALMA,GUATEMALA,MIXCO,
01-08-7680-46,COLEGIO BROWN S POR MADUREZ,GUATEMALA,MIXCO,
01-08-7692-46,CENTRO EDUCATIVO EFICIENCIA POR MADUREZ,GUATEMALA,MIXCO,
01-08-7693-46,CENTRO EDUCATIVO EFICIENCIA,GUATEMALA,MIXCO,
01-08-7770-46,COLEGIO CIENCIA TRABAJO Y VIRTUD,GUATEMALA,MIXCO,
01-08-7772-46,COLEGIO CIENCIA TRABAJO Y VIRTUD,GUATEMALA,MIXCO,
01-08-7968-46,LICEO MINERVA,GUATEMALA,MIXCO,
01-08-7973-46,ESCUELA PARA ADULTOS SPENCER W KIMBALL,GUATEMALA,MIXCO,
01-08-8354-46,COLEGIO CATOLICO LOS OLIVOS,GUATEMALA,MIXCO,
01-08-8405-46,COLEGIO REAL ESPANOL,GUATEMALA,MIXCO,
01-08-8406-46,COLEGIO REAL ESPANOL,GUATEMALA,MIXCO,
01-08-8407-46,COLEGIO REAL ESPANOL,GUATEMALA,MIXCO,
01-08-8559-46,COLEGIO JESUS REY DE GLORIA,GUATEMALA,MIXCO,
01-08-8561-46,COLEGIO JESUS REY DE GLORIA,GUATEMALA,MIXCO,
01-08-8742-46,CENTRO EDUCATIVO ADVENIAT VENGA A NOSOTROS,GUATEMALA,MIXCO,
01-08-9327-46,LICEO CANADIENSE ROOSEVELT,GUATEMALA,MIXCO,
01-08-9328-46,LICEO CANADIENSE ROOSEVELT,GUATEMALA,MIXCO,
01-08-9330-46,LICEO CANADIENSE ROOSEVELT,GUATEMALA,MIXCO,
01-08-9332-46,LICEO CANADIENSE ROOSEVELT,GUATEMALA,MIXCO,
01-08-9398-46,INSTITUTO TECNOLOGICO VOCACIONAL MINERVA,GUATEMALA,MIXCO,
01-08-9667-46,COLEGIO PROYECTO EDUCATIVO FUTURISTA,GUATEMALA,MIXCO,
01-08-9668-46,COLEGIO PROYECTO EDUCATIVO FUTURISTA,GUATEMALA,MIXCO,
01-08-9713-46,LICEO MODERNO SAN CRISTOBAL JORNADA VESPERTINA,GUATEMALA,MIXCO,
01-10-1832-46,INSTITUTO PRIVADO MIXTO DE EDUCACION DIVERSIFICADA SAN JUAN,GUATEMALA,SAN JUAN SACATEPEQUEZ,
01-10-2672-46,INSTITUTO PRIVADO MIXTO DE EDUCACION DIVERSIFICADA CENTRO CULTURAL ABC,GUATEMALA,SAN JUAN SACATEPEQUEZ,
01-10-6476-46,LICEO INTEGRAL CIENTIFICO,GUATEMALA,SAN JUAN SACATEPEQUEZ,
01-10-7978-46,LICEO MIXTO YOSHUA JESUS SALVADOR,GUATEMALA,SAN JUAN SACATEPEQUEZ,
01-10-9529-46,COLEGIO MIXTO ATENAS,GUATEMALA,SAN JUAN SACATEPEQUEZ,
01-10-9556-46,ESCUELA POLITECNICA,GUATEMALA,SAN JUAN SACATEPEQUEZ,
01-11-4000-46,ESCUELA DE CIENCIAS COMERCIALES ADSCRITO AL INEB,GUATEMALA,SAN RAYMUNDO,
01-11-9475-46,COLEGIO MIXTO SAN RAYMUNDO,GUATEMALA,SAN RAYMUNDO,
01-12-0004-46,INSTITUTO DIVERSIFICADO POR COOPERATIVA,GUATEMALA,CHUARRANCHO,
01-13-2892-46,COLEGIO BILINGUE VALENCIA,GUATEMALA,FRAIJANES,
01-13-2916-46,IEBC,GUATEMALA,FRAIJANES,
01-13-8878-46,INSTITUTO MUNICIPAL DE EDUCACION DIVERSIFICADA FRAIJANES I M E D FRAIJANES,GUATEMALA,FRAIJANES,
01-13-9630-46,COLEGIO MONTE ALTO,GUATEMALA,FRAIJANES,
01-14-0013-46,INSTITUTO PRIVADO MIXTO DE COMPUTACION INFORMATICA ICI,GUATEMALA,AMATITLAN,
01-14-0014-46,INSTITUTO PRIVADO MIXTO DE COMPUTACION INFORMATICA ICI,GUATEMALA,AMATITLAN,
01-14-0016-46,INSTITUTO PRIVADO MIXTO DE COMPUTACION INFORMATICA,GUATEMALA,AMATITLAN,
01-14-0018-46,INSTITUTO PRIVADO MIXTO DE COMPUTACION INFORMATICA ICI,GUATEMALA,AMATITLAN,
01-14-0135-46,COLEGIO PEDAGOGICO INTEGRAL ALBORADA,GUATEMALA,AMATITLAN,
01-14-0209-46,INSTITUTO NACIONAL DE EDUCACION DIVERSIFICADA,GUATEMALA,AMATITLAN,
01-14-1923-46,INSTITUTO PRIVADO MIXTO DE EDUCACION DIVERSIFICADA,GUATEMALA,AMATITLAN,
01-14-2424-46,INSTITUTO PRIVADO MIXTO DE EDUCACION DIVERSIFICADA LICEO MODERNO AMATITLAN,GUATEMALA,AMATITLAN,
01-14-4008-46,COLEGIO EVANGELICO MONTE SION SABATINO,GUATEMALA,AMATITLAN,
01-14-6185-46,COLEGIO MIXTO MODERNO,GUATEMALA,AMATITLAN,
01-14-7048-46,INSTITUTO HAZ DEL SABER,GUATEMALA,AMATITLAN,
01-14-7808-46,COLEGIO CRISTIANO CAMINO DE VIDA,GUATEMALA,AMATITLAN,
01-14-7918-46,COLEGIO SAN LORENZO,GUATEMALA,AMATITLAN,
01-14-7920-46,COLEGIO SAN LORENZO,GUATEMALA,AMATITLAN,
01-14-9538-46,COLEGIO CRISTIANO UN NUEVO DIA,GUATEMALA,AMATITLAN,
01-14-9709-46,COLEGIO CRISTIANO UN NUEVO DIA,GUATEMALA,AMATITLAN,
01-14-9844-46,COLEGIO BILINGUE MONTE SOFIA,GUATEMALA,AMATITLAN,
01-15-0051-46,INSTITUTO MIXTO NOCTURNO DE FORMACION TECNICA INTEGRAL CENTROAMERICANO,GUATEMALA,VILLA NUEVA,
01-15-0052-46,CENTRO EDUCATIVO JOSE MILLA Y VIDAURRE,GUATEMALA,VILLA NUEVA,
01-15-0063-46,INSTITUTO NACIONAL DE EDUCACION DIVERSIFICADA,GUATEMALA,VILLA NUEVA,
01-15-0074-46,INSTITUTO NACIONAL DE EDUCACION DIVERSIFICADA,GUATEMALA,VILLA NUEVA,
01-15-0102-46,COLEGIO CRISTIANO HERMOSO JESUS,GUATEMALA,VILLA NUEVA,
01-15-0106-46,COLEGIO CRISTIANO EL OLIVO,GUATEMALA,VILLA NUEVA,
01-15-0108-46,COLEGIO MIXTO REAL EL VALLE,GUATEMALA,VILLA NUEVA,
01-15-0138-46,INSTITUTO MIXTO NOCTURNO DE EDUCACION BASICA Y BACHILLERATO POR MADUREZ Y COMERCIAL 17 DE ABRIL,GUATEMALA,VILLA NUEVA,
01-15-0173-46,COLEGIO EVANGELICO BET EL SHAMMA,GUATEMALA,VILLA NUEVA,
01-15-0520-46,LICEO VALLES DEL SOL,GUATEMALA,VILLA NUEVA,
01-15-2075-46,INSTITUTO PRIVADO MIXTO DE EDUCACION DIVERSIFICADA LICEO CATOLICO,GUATEMALA,VILLA NUEVA,
01-15-2080-46,INSTITUTO PRIVADO MIXTO DE EDUCACION DIVERSIFICADA LICEO VILLA NUEVA,GUATEMALA,VILLA NUEVA,
01-15-2400-46,INSTITUTO PRIVADO MIXTO DE EDUCACION DIVERSIFICADA COLEGIO NUESTRA PATRIA,GUATEMALA,VILLA NUEVA,
01-15-2404-46,INSTITUTO PRIVADO MIXTO DE EDUCACION DIVERSIFICADA CENTRO DE FORMACION INTELECTUAL GUATEMALTECO,GUATEMALA,VILLA NUEVA,
01-15-2406-46,INSTITUTO PRIVADO MIXTO DE EDUCACION DIVERSIFICADA CENTRO DE FORMACION INTELECTUAL GUATEMALTECO,GUATEMALA,VILLA NUEVA,
01-15-2412-46,INSTITUTO PRIVADO MIXTO DE EDUCACION DIVERSIFICADA 17 DE ABRIL,GUATEMALA,VILLA NUEVA,
01-15-2417-46,INSTITUTO PRIVADO MIXTO DE EDUCACION DIVERSIFICADA BACHILLERATO EN CIENCIAS Y LETRAS POR MADUREZ,GUATEMALA,VILLA NUEVA,
01-15-2427-46,INSTITUTO PRIVADO DE EDUCACION DIVERSIFICADA CENTRO EDUCATIVO JOSE MILLA Y VIDAURRE,GUATEMALA,VILLA NUEVA,
01-15-2722-46,INSTITUTO PRIVADO MIXTO DE EDUCACION DIVERSIFICADA COLEGIO CENTRO EDUCATIVO MODERNO,GUATEMALA,VILLA NUEVA,
01-15-2723-46,INSTITUTO PRIVADO MIXTO DE EDUCACION DIVERSIFICADA COLEGIO CENTRO EDUCACIONAL MODERNO,GUATEMALA,VILLA NUEVA,
01-15-2733-46,INSTITUTO PRIVADO MIXTO DE EDUCACION DIVERSIFICADA LICEO CATOLICO,GUATEMALA,VILLA NUEVA,
01-15-2734-46,INSTITUTO PRIVADO MIXTO DE EDUCACION DIVERSIFICADA COLEGIO EVANGELICO EL MESIAS,GUATEMALA,VILLA NUEVA,
01-15-2791-46,INSTITUTO PRIVADO MIXTO DE EDUCACION DIVERSIFICADA CENTRO DE FORMACION INTELECTUAL GUATEMALTECO,GUATEMALA,VILLA NUEVA,
01-15-2893-46,INSTITUTO PARTICULAR MIXTO BENEDICTINO,GUATEMALA,VILLA NUEVA,
01-15-3044-46,CENTRO DE ESTUDIOS DE INFORMATICA Y TECNOLOGIA,GUATEMALA,VILLA NUEVA,
01-15-3093-46,COLEGIO MIXTO FERDINAND DE SAUSSURE,GUATEMALA,VILLA NUEVA,
01-15-4153-46,COLEGIO PRIVADO MIXTO CAMPO VERDE,GUATEMALA,VILLA NUEVA,
01-15-4155-46,INSTITUTO PRIVADO MIXTO GUATEMALA DE LA ASUNCION,GUATEMALA,VILLA NUEVA,
01-15-4422-46,CENTRO EDUCATIVO BILINGUE MADELIN,GUATEMALA,VILLA NUEVA,
01-15-4435-46,INSTITUTO PRIVADO GUATEMALA DE LA ASUNCION,GUATEMALA,VILLA NUEVA,
01-15-6188-46,INSTITUTO PRIVADO MIXTO DE EDUCACION BASICA Y BACHILLERATO EN CIENCIAS Y LETRAS POR MADUREZ,GUATEMALA,VILLA NUEVA,
01-15-6271-46,CENTRO INDUSTRIAL NO 7 ANEXO A LA EOUM NO 99 CONFEDERACION SUIZA,GUATEMALA,VILLA NUEVA,
01-15-6571-46,INSTITUTO PRIVADO MIXTO LINDA VISTA,GUATEMALA,VILLA NUEVA,
01-15-6572-46,INSTITUTO PRIVADO MIXTO LINDA VISTA,GUATEMALA,VILLA NUEVA,
01-15-7132-46,COLEGIO MIXTO MARTA MARIA,GUATEMALA,VILLA NUEVA,
01-15-7423-46,COLEGIO MONTEVISION,GUATEMALA,VILLA NUEVA,
01-15-7425-46,COLEGIO MONTEVISION,GUATEMALA,VILLA NUEVA,
01-15-7677-46,INSTITUTO DE EDUCACION DIVERSIFICADA POR COOPERATIVA,GUATEMALA,VILLA NUEVA,
01-15-7716-46,COLEGIO PAZ DESARROLLO Y EXITO,GUATEMALA,VILLA NUEVA,
01-15-7858-46,INSTITUO MIXTO NOCTURNO EL ANGEL,GUATEMALA,VILLA NUEVA,
01-15-8223-46,COLEGIO PRIVADOMIXTO NUESTRA SENORA DELAS MERCEDES,GUATEMALA,VILLA NUEVA,
01-15-8297-46,LICEO PEDAGOGICO SAN JUDAS TADEO,GUATEMALA,VILLA NUEVA,
01-15-8676-46,COLEGIO PRIVADO RENACIMIENTO,GUATEMALA,VILLA NUEVA,
01-15-8696-46,ESCUELA PARTICULAR EXPERIMENTAL CRISTIANA EL VERBO 3,GUATEMALA,VILLA NUEVA,
01-15-8839-46,INSTITUTO DE EDUCACION BASICA Y BACHILLERATO POR MADUREZ,GUATEMALA,VILLA NUEVA,
01-15-9074-46,COLEGIO LUIS REY,GUATEMALA,VILLA NUEVA,
01-15-9157-46,LICEO TECNICO DE VILLA NUEVA,GUATEMALA,VILLA NUEVA,
01-15-9217-46,CENTRO CRISTIANO EDUCACIONAL VIDA,GUATEMALA,VILLA NUEVA,
01-15-9469-46,CENTRO EDUCATIVO MANUEL GALICH,GUATEMALA,VILLA NUEVA,
01-15-9604-46,COLEGIO EVANGELICO AMIGOS,GUATEMALA,VILLA NUEVA,
01-15-9791-46,LICEO VILLA NUEVA,GUATEMALA,VILLA NUEVA,
01-16-2370-46,INSTITUTO PRIVADO MIXTO DE EDUCACION DIVERSIFICADA FORMACION INTEGRAL B D M JV,GUATEMALA,VILLA CANALES,
01-16-4544-46,INSTITUTO PARTICULAR MIXTO CARLOS HUMBERTO AGUIRRE PEREZ JN,GUATEMALA,VILLA CANALES,
01-17-0046-46,INSTITUTO NACIONAL DE EDUCACION DIVERSIFICADA,GUATEMALA,SAN MIGUEL PETAPA,
01-17-0289-46,CENTRO CULTURAL SAGRADA FAMILIA NO 2,GUATEMALA,SAN MIGUEL PETAPA,
01-17-0296-46,COLEGIO CEDROS INTEGRAL,GUATEMALA,SAN MIGUEL PETAPA,
01-17-2372-46,INSTITUTO PRIVADO MIXTO DE EDUCACION DIVERSIFICADA SAN MIGUEL,GUATEMALA,SAN MIGUEL PETAPA,
01-17-2973-46,COLEGIO CIENTIFICO DE COMPUTACION PROFESIONAL DIVERSIFICADO,GUATEMALA,SAN MIGUEL PETAPA,
01-17-4186-46,LICEO PRIVADO MIXTO VILLAHERMOSA,GUATEMALA,SAN MIGUEL PETAPA,
01-17-6534-46,CENTRO ESTUDIANTIL FENIX CEF,GUATEMALA,SAN MIGUEL PETAPA,
01-17-6793-46,COLEGIO TECNICO ESTUDIANTIL PROF CARLOS OVIDIO MILIAN,GUATEMALA,SAN MIGUEL PETAPA,
01-17-8861-46,INSTITUTO MUNICIPAL DE DIVERSIFICADO SAN MIGUEL PETAPA,GUATEMALA,SAN MIGUEL PETAPA,
01-17-8875-46,LICEO COMPUTARIZADO SAN ARCANGEL,GUATEMALA,SAN MIGUEL PETAPA,
01-17-9137-46,COLEGIO PRIVADO MIXTO NUESTRA SENORA DE LAS MERCEDES,GUATEMALA,SAN MIGUEL PETAPA,
18-01-0037-46,INSTITUTO PRIVADO MIXTO DE EDUCACION DIVERSIFICADA COLEGIO CRISTO REY JN,IZABAL,PUERTO BARRIOS,
18-01-0115-46,COLEGIO MIXTO EXPERIMENTAL EDUCARE,IZABAL,PUERTO BARRIOS,
18-01-0155-46,ESCUELA PARTICULAR MIXTA JUSTO RUFINO BARRIOS,IZABAL,PUERTO BARRIOS,
18-01-0162-46,COLEGIO PARTICULAR MIXTO PIEDRAS NEGRAS,IZABAL,PUERTO BARRIOS,
18-01-0305-46,INSTITUTO INTERCULTURAL MIXTO KATOK WINAQ,IZABAL,PUERTO BARRIOS,
18-01-0306-46,INSTITUTO INTERCULTURAL MIXTO KATOK WINAQ,IZABAL,PUERTO BARRIOS,
18-01-0307-46,INSTITUTO INTERCULTURAL MIXTO KATOK WINAQ,IZABAL,PUERTO BARRIOS,
18-01-0308-46,INSTITUTO INTERCULTURAL MIXTO KATOK WINAQ,IZABAL,PUERTO BARRIOS,
18-01-0327-46,COLEGIO PRIVADO MIXTO ECOLOGICO CAMPO Y VIDA,IZABAL,PUERTO BARRIOS,
18-01-0343-46,LICEO MIXTO BILINGUE CANADIENSE,IZABAL,PUERTO BARRIOS,
18-01-0344-46,LICEO MIXTO BINLINGUE CANADIENSE,IZABAL,PUERTO BARRIOS,
18-01-0365-46,LICEO DR LUIS VON AHN,IZABAL,PUERTO BARRIOS,
18-01-0711-46,INSTITUTO PRIVADO MIXTO DE EDUCACION BASICA ASOPROBA,IZABAL,PUERTO BARRIOS,
18-01-1083-46,COLEGIO BILINGUE PARA SENORITAS SANTA MARTHA,IZABAL,PUERTO BARRIOS,
18-01-2004-46,COLEGIO DE CIENCIAS DE LA COMPUTACION,IZABAL,PUERTO BARRIOS,
18-01-2562-46,INSTITUTO GUATEMALTECO DE EDUCACION RADIOFONICA IGER,IZABAL,PUERTO BARRIOS,
18-01-2733-46,INSTITUTO PARTICULAR MIXTO EDUCATIVO INTEGRAL POR MADUREZ,IZABAL,PUERTO BARRIOS,
18-01-2828-46,LICEO TECNICO VOCACIONAL MAYA,IZABAL,PUERTO BARRIOS,
18-01-2834-46,INSTITUTO DIVERSIFICADO EN TECNOLOGIA Y TRABAJO INDUSTRIAL,IZABAL,PUERTO BARRIOS,
18-01-3089-46,INSTITUTO DIVERSIFICADO SAN JOSE,IZABAL,PUERTO BARRIOS,
18-01-3186-46,LICEO MIXTO MODERNO,IZABAL,PUERTO BARRIOS,
18-01-3269-46,LICEO MIXTO PASCAL,IZABAL,PUERTO BARRIOS,
18-02-0347-46,INSTITUTO PRIVADO MIXTO HERMANO PEDRO DE BETANCUR,IZABAL,LIVINGSTON,
18-02-0389-46,INSTITUTO PRIVADO MIXTO HERMANO PEDRO DE BETANCUR,IZABAL,LIVINGSTON,
18-03-0246-46,INSTITUTO PRIVADO MIXTO DE EDUCACION DIVERSIFICADA PERITO CONTADOR JN,IZABAL,EL ESTOR,
18-03-2527-46,LIC GERARD ANTHONY ALLEN ROWE,IZABAL,EL ESTOR,
18-03-2749-46,ESCUELA NORMAL BILINGUE INTERCULTURAL TZOLEB AAL TIJONEL Q EQCHI OXIB KEJ,IZABAL,EL ESTOR,
18-04-0016-46,COLEGIO PARTICULAR MIXTO MINERVA,IZABAL,MORALES,
18-04-0176-46,LICEO ALVAREZ OVALLE,IZABAL,MORALES,
18-04-0177-46,LICEO ALVAREZ OVALLE,IZABAL,MORALES,
18-04-0198-46,INSTITUTO PARTICULAR MIXTO DE EDUCACION DIVERSIFICADA LANQUIN I,IZABAL,MORALES,
18-04-0228-46,LICEO ALVAREZ OVALLE,IZABAL,MORALES,
18-04-0246-46,LICEO EDUCACIONAL MIXTO DEI VERBUM,IZABAL,MORALES,
18-04-0374-46,INSTITUTO PRIVADO MIXTO DE EDUCACION DIVERSIFICADA COLEGIO DE CIENCIAS DE LA COMPUTACION,IZABAL,MORALES,
18-04-0375-46,INSTITUTO PRIVADO MIXTO DE EDUCACION DIVERSIFICADA CENTROAMERICANO JV,IZABAL,MORALES,
18-04-0380-46,LICEO EDUCACIONAL MIXTO DEI VERBUM,IZABAL,MORALES,
18-04-0415-46,LICEO EUCARISTICO DE LA MERCED,IZABAL,MORALES,
18-04-2302-46,INSTITUTO PARTICULAR MIXTO,IZABAL,MORALES,
18-04-3275-46,INSTITUTO PARTICULAR MIXTO DE EDUCACION BASICA Y DIVERSIFICADA DR PEDRO MOLINA,IZABAL,MORALES,
18-05-0090-46,INSTITUTO PARTICULAR MIXTO DE EDUCACION BASICA AMILCAR SAGASTUME RAMIREZ,IZABAL,LOS AMATES,
18-05-0484-46,INSTITUTO PRIVADO MIXTO DE EDUCACION DIVERSIFICADA EN CIENCIAS COMERCIALES JV,IZABAL,LOS AMATES,
09-01-0040-46,COLELGIO EVANGELICO LA PATRIA,QUETZALTENANGO,QUETZALTENANGO,
09-01-0149-46,INSTITUTO PRIVADO MIXTO DE EDUCACION DIVERSIFICADA LICEO QUEZALTECO,QUETZALTENANGO,QUETZALTENANGO,
09-01-0151-46,INSTITUTO PRIVADO MIXTO DE EDUCACION DIVERSIFICADA COLEGIO CORAZON DE JESUS,QUETZALTENANGO,QUETZALTENANGO,
09-01-0196-46,INSTITUTO NACIONAL DE EDUCACION DIVERSIFICADA,QUETZALTENANGO,QUETZALTENANGO,
09-01-0872-46,INSTITUTO DE ESTUDIOS AVANZADOS JOSE MARTI,QUETZALTENANGO,QUETZALTENANGO,
09-01-0889-46,INSTITUTO NOCTURNO EXPERIMENTAL DE EDUCACION MEDIA HUMANIDADES,QUETZALTENANGO,QUETZALTENANGO,
09-01-0894-46,INSTITUTO PRIVADO MIXTO NOCTURNO DE EDUCACION DIVERSIFICADA QUETZALTENANGO,QUETZALTENANGO,QUETZALTENANGO,
09-01-0915-46,ESCUELA PRIVADA DE EDUCACION DE ADULTOS POPOL VUH,QUETZALTENANGO,QUETZALTENANGO,
09-01-1084-46,INSTITUTO PRIVADO MIXTO BARILLAS,QUETZALTENANGO,QUETZALTENANGO,
09-01-1384-46,ESCUELA DE ARTES Y OFICIOS FEMENILES,QUETZALTENANGO,QUETZALTENANGO,
09-01-2753-46,EPRM BARILLAS,QUETZALTENANGO,QUETZALTENANGO,
09-01-3014-46,ESCUELA PARTICULAR CRISTIANA VERBO,QUETZALTENANGO,QUETZALTENANGO,
09-01-3238-46,COLEGIO PRIVADO MIXTO ISAAC NEWTON,QUETZALTENANGO,QUETZALTENANGO,
09-01-3240-46,COLEGIO PRIVADO MIXTO ISAAC NEWTON,QUETZALTENANGO,QUETZALTENANGO,
09-01-3536-46,INSTITUTO GUATEMALTECO DE EDUCACION RADIOFONICA IGER,QUETZALTENANGO,QUETZALTENANGO,
09-01-3611-46,COLEGIO UNIVERSITARIO FRIEDRICH VON HAYEK,QUETZALTENANGO,QUETZALTENANGO,
09-01-3616-46,COLEGIO PRIVADO MIXTO LICEO MODERNO,QUETZALTENANGO,QUETZALTENANGO,
09-01-3623-46,CENTRO DE ESTUDIOS TECNICOS NUEVA SEMILLA,QUETZALTENANGO,QUETZALTENANGO,
09-01-3817-46,COLEGIO PRE UNIVERSITARIO FRIEDRICH VON HAYEK,QUETZALTENANGO,QUETZALTENANGO,
09-01-3870-46,INSTITUTO DE ESTUDIOS AVANZADOS I E A CAMPUS LAS AMERICAS,QUETZALTENANGO,QUETZALTENANGO,
09-03-4178-46,CENTRO DE ESTUDIOS MODERNOS NOVISIMA ACADEMIA,QUETZALTENANGO,OLINTEPEQUE,
09-04-0873-46,ESCUELA PRIVADA NORMAL DE MAGISTERIO OCUPACIONAL,QUETZALTENANGO,SAN CARLOS SIJA,
09-06-0025-46,INSTITUTO NACIONAL DE EDUCACION DIVERSIFICADA,QUETZALTENANGO,CABRICAN,
09-06-3693-46,COLEGIO INTEGRAL EMPRESARIAL POR MADUREZ,QUETZALTENANGO,CABRICAN,
09-08-0917-46,CENTRO INDUSTRIAL RURAL NO 1,QUETZALTENANGO,SAN MIGUEL SIGUILA,
09-09-0030-46,INSTITUTO NACIONAL DE EDUCACION DIVERSIFICADA,QUETZALTENANGO,SAN JUAN OSTUNCALCO,
09-09-0031-46,INSTITUTO NACIONAL DE EDUCACION DIVERSIFICADA,QUETZALTENANGO,SAN JUAN OSTUNCALCO,
09-09-0328-46,INSTITUTO PRIVADO MIXTO DE EDUCACION DIVERSIFICADA CENTRO EDUCATIVO LICENCIADO ANIBAL DE LEON MALDONADO,QUETZALTENANGO,SAN JUAN OSTUNCALCO,
09-09-0329-46,INSTITUTO PRIVADO MIXTO DE EDUCACION DIVERSIFICADA COLEGIO CENTROAMERICANO,QUETZALTENANGO,SAN JUAN OSTUNCALCO,
09-09-0333-46,INSTITUTO PRIVADO MIXTO DE EDUCACION DIVERSIFICADA COLEGIO CENTROAMERICANO,QUETZALTENANGO,SAN JUAN OSTUNCALCO,
09-09-0766-46,INSTITUTO PRIVADO MIXTO DE EDUCACION DIVERSIFICADA CENTRO EDUCATIVO LICENCIADO ANIBAL DE LEON MALDONADO,QUETZALTENANGO,SAN JUAN OSTUNCALCO,
09-09-1310-46,COLEGIO EVANGELICO MIXTO ALFA,QUETZALTENANGO,SAN JUAN OSTUNCALCO,
09-09-3887-46,ENBI ADSCRITA A ENBI JAXNAQ TZB AL MAM KYE AJXNAQ TZAL,QUETZALTENANGO,SAN JUAN OSTUNCALCO,
09-13-0006-46,INSTITUTO NACIONAL DE EDUCACION DIVERSIFICADA,QUETZALTENANGO,ALMOLONGA,
09-13-3193-46,COLEGIO PRIVADO MIXTO AMERICA,QUETZALTENANGO,ALMOLONGA,
09-15-2615-46,COLEGIO PRIVADO MIXTO DE EDUCACION MEDIA LICEO HUITANECO,QUETZALTENANGO,HUITAN,
09-19-1112-46,INSTITUTO MIXTO DE DIVERIFICADO BACHILLERATO AGRICOLA Y COMPUTACION SANTIAGO APOSTOL,QUETZALTENANGO,EL PALMAR,
09-19-2612-46,ISNTITUTO MIXTO SANTIAGO APOSTOL,QUETZALTENANGO,EL PALMAR,
09-20-0657-46,INSTITUTO PRIVADO MIXTO DE EDUCACION DIVERSIFICADA RAFAEL AREVALO MARTINEZ,QUETZALTENANGO,COATEPEQUE,
09-20-0658-46,INSTITUTO PRIVADO PARA SENORITAS DE EDUCACION DIVERSIFICADA TECNICA FEMENINA DE EDUCACION PARA EL HOGAR,QUETZALTENANGO,COATEPEQUE,
09-20-0664-46,INSTITUTO PRIVADO MIXTO DE EDUCACION DIVERSIFICADA CENTROAMERICANO,QUETZALTENANGO,COATEPEQUE,
